{
  "metadata": {
    "chapterId": "path_ch1",
    "title": "",
    "subject": "Pathology",
    "subjectId": "pathology",
    "version": "1.0",
    "lastUpdated": "2026-06-26",
    "status": "published",
    "difficulty": "Medium",
    "estimatedStudyTime": 60,
    "keywords": [],
    "tags": []
  },
  "learningObjectives": [],
  "theory": {
    "definitions": [],
    "coreConcepts": [],
    "equipment": []
  },
  "clinicalCorrelations": {
    "pearls": [],
    "precautions": [],
    "indications": [],
    "contraindications": {
      "general": [],
      "local": []
    },
    "technique": {
      "patientPreparation": [],
      "apparatusPreparation": [],
      "skinPreparation": [],
      "electrodePlacement": [],
      "treatmentProcedure": []
    },
    "protocols": [],
    "physiologicalEffects": []
  },
  "clinicalCases": [],
  "mcqs": [
    {
      "id": "mcq_path_ch1_001",
      "question": "Which of the following cellular adaptations is characterized by an increase in the NUMBER of cells in an organ or tissue?",
      "options": [
        "Hypertrophy",
        "Hyperplasia",
        "Atrophy",
        "Metaplasia"
      ],
      "answer": "Hyperplasia",
      "explanation": "Hyperplasia refers to an increase in the number of cells, whereas hypertrophy refers to an increase in the size of individual cells."
    },
    {
      "id": "mcq_path_ch1_002",
      "question": "The transformation of ciliated columnar epithelium to squamous epithelium in the respiratory tract of a chronic smoker is an example of:",
      "options": [
        "Dysplasia",
        "Hyperplasia",
        "Metaplasia",
        "Anaplasia"
      ],
      "answer": "Metaplasia",
      "explanation": "Metaplasia is a reversible change in which one adult cell type is replaced by another adult cell type, often to withstand a harsh environment, such as the respiratory tract adapting to cigarette smoke."
    },
    {
      "id": "mcq_path_ch1_003",
      "question": "Which type of necrosis is typically seen in an acute myocardial infarction (heart attack)?",
      "options": [
        "Liquefactive necrosis",
        "Coagulative necrosis",
        "Caseous necrosis",
        "Fat necrosis"
      ],
      "answer": "Coagulative necrosis",
      "explanation": "Coagulative necrosis is the characteristic pattern of cell death in hypoxic/ischemic death of cells in all solid organs except the brain."
    },
    {
      "id": "mcq_path_ch1_004",
      "question": "A patient with hyperparathyroidism develops high serum calcium levels, leading to calcium deposition in the kidneys and lungs. This is an example of:",
      "options": [
        "Dystrophic calcification",
        "Metastatic calcification",
        "Intracellular accumulation",
        "Amyloidosis"
      ],
      "answer": "Metastatic calcification",
      "explanation": "Metastatic calcification occurs when calcium deposits in normal tissues as a result of hypercalcemia. Dystrophic calcification occurs in dead/dying tissues with normal serum calcium."
    },
    {
      "id": "mcq_path_ch1_005",
      "question": "Which mechanism is responsible for the rapid damage seen in Ischemia-Reperfusion injury?",
      "options": [
        "Immediate apoptosis of healthy cells",
        "Generation of Reactive Oxygen Species (ROS)",
        "Metaplastic transformation",
        "Decreased intracellular calcium"
      ],
      "answer": "Generation of Reactive Oxygen Species (ROS)",
      "explanation": "Restoring blood flow brings oxygen back to damaged mitochondria, which rapidly generate Reactive Oxygen Species (ROS), causing further membrane and DNA damage."
    },
    {
      "id": "mcq_path_ch1_006",
      "question": "In Wallerian degeneration, which part of the neuron undergoes degeneration?",
      "options": [
        "The cell body",
        "The dendrites",
        "The axon distal to the injury site",
        "The axon proximal to the injury site"
      ],
      "answer": "The axon distal to the injury site",
      "explanation": "Wallerian degeneration is the active process of degeneration that occurs in the axon and its myelin sheath distal to the site of a nerve lesion."
    },
    {
      "id": "mcq_path_ch1_007",
      "question": "Disuse atrophy, commonly seen by physiotherapists in patients with limbs immobilized in casts, is primarily caused by:",
      "options": [
        "Loss of endocrine stimulation",
        "Inadequate nutrition",
        "Decreased workload",
        "Loss of innervation"
      ],
      "answer": "Decreased workload",
      "explanation": "Disuse atrophy occurs due to a decreased workload on the muscle. Early mobilization and exercise help reverse or prevent this condition."
    },
    {
      "id": "mcq_path_ch1_008",
      "question": "Which of the following histopathological staining characteristics is diagnostic for amyloidosis under polarized light microscopy?",
      "options": [
        "Prussian Blue staining showing dark blue granules",
        "Congo Red staining showing apple-green birefringence",
        "Periodic Acid-Schiff (PAS) staining showing magenta-colored glycogen",
        "Sudan Black staining showing dark lipid droplets"
      ],
      "answer": "Congo Red staining showing apple-green birefringence",
      "explanation": "Amyloid fibrils have a beta-pleated sheet conformation that binds Congo Red dye, producing a characteristic apple-green birefringence when viewed under polarized light."
    }
  ],
  "viva": [],
  "flashcards": [],
  "pyqs": [],
  "references": [],
  "subjectExtensions": {}
}