{
  "metadata": {
    "chapterId": "path_ch11",
    "title": "",
    "subject": "Pathology",
    "subjectId": "pathology",
    "version": "1.0",
    "lastUpdated": "2026-06-26",
    "status": "published",
    "difficulty": "Medium",
    "estimatedStudyTime": 60,
    "keywords": [],
    "tags": []
  },
  "learningObjectives": [],
  "theory": {
    "definitions": [],
    "coreConcepts": [],
    "equipment": []
  },
  "clinicalCorrelations": {
    "pearls": [],
    "precautions": [],
    "indications": [],
    "contraindications": {
      "general": [],
      "local": []
    },
    "technique": {
      "patientPreparation": [],
      "apparatusPreparation": [],
      "skinPreparation": [],
      "electrodePlacement": [],
      "treatmentProcedure": []
    },
    "protocols": [],
    "physiologicalEffects": []
  },
  "clinicalCases": [],
  "subjectExtensions": {},
  "mcqs": [
    {
      "id": "mcq_path_ch11_001",
      "question": "Which of the following conditions is anatomically characterized by the permanent enlargement of air spaces distal to the terminal bronchioles accompanied by destruction of their walls?",
      "options": [
        "Chronic Bronchitis",
        "Bronchial Asthma",
        "Emphysema",
        "Bronchiectasis"
      ],
      "answer": "Emphysema",
      "explanation": "This is the classic anatomical definition of Emphysema, contrasting with the clinical definition of Chronic Bronchitis."
    },
    {
      "id": "mcq_path_ch11_002",
      "question": "A 10-year-old boy presents with episodic wheezing and shortness of breath triggered by pollen. The pathogenesis involves IgE-mediated mast cell degranulation. The most likely diagnosis is:",
      "options": [
        "Atopic Asthma",
        "Cystic Fibrosis",
        "Primary Tuberculosis",
        "Lobar Pneumonia"
      ],
      "answer": "Atopic Asthma",
      "explanation": "Atopic asthma is a classic Type I hypersensitivity reaction triggered by environmental allergens."
    },
    {
      "id": "mcq_path_ch11_003",
      "question": "Which of the following is considered a Restrictive lung disease?",
      "options": [
        "Emphysema",
        "Idiopathic Pulmonary Fibrosis",
        "Chronic Bronchitis",
        "Bronchiectasis"
      ],
      "answer": "Idiopathic Pulmonary Fibrosis",
      "explanation": "IPF causes widespread fibrosis of the lung interstitium, preventing the lungs from expanding fully, characteristic of restrictive disease."
    },
    {
      "id": "mcq_path_ch11_004",
      "question": "Secondary (Reactivation) Tuberculosis most characteristically localizes to which part of the lung?",
      "options": [
        "Lower lobes bilaterally",
        "Apices of the upper lobes",
        "Hilum of the lung",
        "Pleural space"
      ],
      "answer": "Apices of the upper lobes",
      "explanation": "Reactivation TB typically favors the apices (top) of the lungs, likely due to the higher oxygen tension in those regions favoring mycobacterial growth."
    },
    {
      "id": "mcq_path_ch11_005",
      "question": "A patient expectorates a large cupful of foul-smelling, purulent sputum every morning. A CT scan shows permanently dilated bronchi extending to the pleura. This describes:",
      "options": [
        "Lobar Pneumonia",
        "Pulmonary Embolism",
        "Emphysema",
        "Bronchiectasis"
      ],
      "answer": "Bronchiectasis",
      "explanation": "Bronchiectasis involves irreversible dilation of bronchi due to chronic necrotizing infections, classically presenting with copious foul sputum."
    },
    {
      "id": "mcq_path_ch11_006",
      "question": "The combination of a peripheral lung parenchymal lesion and enlarged caseating hilar lymph nodes in a child previously unexposed to M. tuberculosis is called the:",
      "options": [
        "Aschoff body",
        "Ghon complex",
        "Asteroid body",
        "Caseous granuloma"
      ],
      "answer": "Ghon complex",
      "explanation": "The Ghon complex is the pathognomonic lesion of Primary Pulmonary Tuberculosis."
    },
    {
      "id": "mcq_path_ch11_007",
      "question": "A patient with long-standing severe COPD is at highest risk of developing which of the following cardiac complications?",
      "options": [
        "Left ventricular hypertrophy",
        "Mitral valve prolapse",
        "Cor Pulmonale (Right ventricular failure)",
        "Aortic dissection"
      ],
      "answer": "Cor Pulmonale (Right ventricular failure)",
      "explanation": "Chronic hypoxemia in COPD causes pulmonary vasoconstriction and pulmonary hypertension, which eventually leads to right heart failure (Cor Pulmonale)."
    },
    {
      "id": "mcq_path_ch11_008",
      "question": "Which phase of lobar pneumonia is characterized by a firm, liver-like exudation of red blood cells, neutrophils, and fibrin into the alveolar spaces?",
      "options": [
        "Congestion",
        "Red Hepatization",
        "Gray Hepatization",
        "Resolution"
      ],
      "answer": "Red Hepatization",
      "explanation": "Red hepatization occurs when the alveoli are packed with RBCs, neutrophils, and fibrin, giving the lung a gross appearance similar to the liver."
    }
  ],
  "viva": [],
  "flashcards": [],
  "pyqs": [],
  "references": []
}