{
  "metadata": {
    "chapterId": "path_ch15",
    "title": "",
    "subject": "Pathology",
    "subjectId": "pathology",
    "version": "1.0",
    "lastUpdated": "2026-06-26",
    "status": "published",
    "difficulty": "Medium",
    "estimatedStudyTime": 60,
    "keywords": [],
    "tags": []
  },
  "learningObjectives": [],
  "theory": {
    "definitions": [],
    "coreConcepts": [],
    "equipment": []
  },
  "clinicalCorrelations": {
    "pearls": [],
    "precautions": [],
    "indications": [],
    "contraindications": {
      "general": [],
      "local": []
    },
    "technique": {
      "patientPreparation": [],
      "apparatusPreparation": [],
      "skinPreparation": [],
      "electrodePlacement": [],
      "treatmentProcedure": []
    },
    "protocols": [],
    "physiologicalEffects": []
  },
  "clinicalCases": [],
  "subjectExtensions": {},
  "mcqs": [
    {
      "id": "mcq_path_ch15_001",
      "question": "The resting tremor, bradykinesia, rigidity, and postural instability seen in Parkinson's Disease are directly caused by a deficiency of which neurotransmitter?",
      "options": [
        "Acetylcholine",
        "Serotonin",
        "Dopamine",
        "GABA"
      ],
      "answer": "Dopamine",
      "explanation": "Parkinson's disease is caused by the degeneration of dopaminergic neurons in the substantia nigra, leading to a profound deficiency of dopamine in the basal ganglia motor circuits."
    },
    {
      "id": "mcq_path_ch15_002",
      "question": "Which of the following diseases is characterized by autoimmune destruction of myelin sheaths exclusively within the Central Nervous System?",
      "options": [
        "Guillain-Barr\u00e9 Syndrome",
        "Amyotrophic Lateral Sclerosis",
        "Multiple Sclerosis",
        "Myasthenia Gravis"
      ],
      "answer": "Multiple Sclerosis",
      "explanation": "Multiple Sclerosis (MS) involves immune-mediated demyelination in the brain and spinal cord (CNS), unlike GBS which affects peripheral nerves."
    },
    {
      "id": "mcq_path_ch15_003",
      "question": "An 80-year-old patient presents with sudden onset right-sided hemiplegia and aphasia. A CT scan shows no bleeding. The most likely diagnosis is:",
      "options": [
        "Hemorrhagic Stroke",
        "Ischemic Stroke",
        "Brain Tumor",
        "Meningitis"
      ],
      "answer": "Ischemic Stroke",
      "explanation": "The sudden onset of focal neurological deficits without hemorrhage on CT strongly points to an ischemic stroke (thrombosis or embolism)."
    },
    {
      "id": "mcq_path_ch15_004",
      "question": "The presence of extracellular Amyloid-beta plaques and intracellular Neurofibrillary tangles in the cerebral cortex is the pathological hallmark of:",
      "options": [
        "Parkinson's Disease",
        "Alzheimer's Disease",
        "Huntington's Disease",
        "Vascular Dementia"
      ],
      "answer": "Alzheimer's Disease",
      "explanation": "These two protein aggregates are the defining microscopic features of Alzheimer's disease."
    },
    {
      "id": "mcq_path_ch15_005",
      "question": "A patient develops rapidly progressive, symmetrical ascending weakness starting in the legs, two weeks after a gastrointestinal infection. The most likely diagnosis is:",
      "options": [
        "Multiple Sclerosis",
        "Poliomyelitis",
        "Guillain-Barr\u00e9 Syndrome",
        "Muscular Dystrophy"
      ],
      "answer": "Guillain-Barr\u00e9 Syndrome",
      "explanation": "GBS classically presents as an acute, post-infectious, ascending paralysis due to autoimmune peripheral nerve demyelination."
    },
    {
      "id": "mcq_path_ch15_006",
      "question": "Which of the following describes a Transient Ischemic Attack (TIA)?",
      "options": [
        "A small brain hemorrhage that resolves with surgery.",
        "A focal neurological deficit caused by ischemia that resolves completely within 24 hours without infarction.",
        "A slow, progressive loss of cognitive function due to micro-infarcts.",
        "A seizure caused by scar tissue from a previous stroke."
      ],
      "answer": "A focal neurological deficit caused by ischemia that resolves completely within 24 hours without infarction.",
      "explanation": "A TIA is a temporary 'warning stroke' where blood flow is blocked just long enough to cause symptoms but not long enough to cause permanent cell death."
    },
    {
      "id": "mcq_path_ch15_007",
      "question": "A patient complains of burning pain and loss of sensation in both feet and hands, resembling a 'stocking-and-glove' distribution. This is most characteristic of:",
      "options": [
        "Spinal cord injury at C5",
        "Diabetic peripheral neuropathy",
        "Stroke in the parietal lobe",
        "Multiple Sclerosis"
      ],
      "answer": "Diabetic peripheral neuropathy",
      "explanation": "Chronic hyperglycemia damages the longest peripheral nerves first, leading to distal symmetrical polyneuropathy (stocking-and-glove pattern)."
    },
    {
      "id": "mcq_path_ch15_008",
      "question": "Nuchal rigidity (stiff neck), photophobia, headache, and fever are the classic clinical signs of:",
      "options": [
        "Meningitis",
        "Encephalitis",
        "Brain abscess",
        "Subdural hematoma"
      ],
      "answer": "Meningitis",
      "explanation": "These are signs of meningeal irritation, characteristic of acute bacterial or viral meningitis."
    }
  ],
  "viva": [],
  "flashcards": [],
  "pyqs": [],
  "references": []
}