{
  "metadata": {
    "chapterId": "el2_ch4",
    "title": "",
    "subject": "Electrotherapy II",
    "subjectId": "electrotherapy_ii",
    "version": "1.0",
    "lastUpdated": "2026-06-26",
    "status": "published",
    "difficulty": "Medium",
    "estimatedStudyTime": 60,
    "keywords": [],
    "tags": []
  },
  "learningObjectives": [],
  "theory": {
    "definitions": [],
    "coreConcepts": [],
    "equipment": []
  },
  "clinicalCorrelations": {
    "pearls": [],
    "precautions": [],
    "indications": [],
    "contraindications": {
      "general": [],
      "local": []
    },
    "technique": {
      "patientPreparation": [],
      "apparatusPreparation": [],
      "skinPreparation": [],
      "electrodePlacement": [],
      "treatmentProcedure": []
    },
    "protocols": [],
    "physiologicalEffects": []
  },
  "clinicalCases": [],
  "subjectExtensions": {},
  "mcqs": [
    {
      "id": "mcq_el2_ch4_001",
      "question": "What is the most commonly used frequency in therapeutic SWD?",
      "options": [
        "13.56 MHz",
        "27.12 MHz",
        "40.68 MHz",
        "2450 MHz"
      ],
      "answer": "27.12 MHz",
      "explanation": "27.12 MHz is the standard, most frequently allocated FCC band for shortwave diathermy applications."
    }
  ],
  "viva": [],
  "flashcards": [],
  "pyqs": [],
  "references": []
}