{
  "metadata": {
    "chapterId": "et2_ift",
    "title": "",
    "subject": "Electrotherapy II",
    "subjectId": "electrotherapy_ii",
    "version": "1.0",
    "lastUpdated": "2026-06-26",
    "status": "published",
    "difficulty": "Medium",
    "estimatedStudyTime": 60,
    "keywords": [],
    "tags": []
  },
  "learningObjectives": [],
  "theory": {
    "definitions": [],
    "coreConcepts": [],
    "equipment": []
  },
  "clinicalCorrelations": {
    "pearls": [],
    "precautions": [],
    "indications": [],
    "contraindications": {
      "general": [],
      "local": []
    },
    "technique": {
      "patientPreparation": [],
      "apparatusPreparation": [],
      "skinPreparation": [],
      "electrodePlacement": [],
      "treatmentProcedure": []
    },
    "protocols": [],
    "physiologicalEffects": []
  },
  "clinicalCases": [],
  "subjectExtensions": {},
  "mcqs": [
    {
      "id": "mcq_et2_ift_001",
      "question": "Interferential therapy is based on:",
      "options": [
        "Induction",
        "Interference of medium frequency currents",
        "Ionization",
        "Galvanization"
      ],
      "answer": "Interference of medium frequency currents",
      "explanation": ""
    },
    {
      "id": "mcq_et2_ift_002",
      "question": "The commonly used carrier frequency in IFT is:",
      "options": [
        "50 Hz",
        "100 Hz",
        "1000 Hz",
        "4000 Hz"
      ],
      "answer": "4000 Hz",
      "explanation": ""
    },
    {
      "id": "mcq_et2_ift_003",
      "question": "Beat frequency is:",
      "options": [
        "Sum of frequencies",
        "Difference between frequencies",
        "Average frequency",
        "Product of frequencies"
      ],
      "answer": "Difference between frequencies",
      "explanation": ""
    },
    {
      "id": "mcq_et2_ift_004",
      "question": "4000 Hz and 3900 Hz produce a beat frequency of:",
      "options": [
        "50 Hz",
        "100 Hz",
        "150 Hz",
        "200 Hz"
      ],
      "answer": "100 Hz",
      "explanation": ""
    },
    {
      "id": "mcq_et2_ift_005",
      "question": "Frequency commonly used for pain relief is:",
      "options": [
        "1\u201310 Hz",
        "15 Hz",
        "80\u2013100 Hz",
        "250 Hz"
      ],
      "answer": "80\u2013100 Hz",
      "explanation": ""
    },
    {
      "id": "mcq_et2_ift_006",
      "question": "Frequency used for absorption of exudates is:",
      "options": [
        "1\u201310 Hz",
        "30\u2013100 Hz",
        "80\u2013100 Hz",
        "250 Hz"
      ],
      "answer": "1\u201310 Hz",
      "explanation": ""
    },
    {
      "id": "mcq_et2_ift_007",
      "question": "Modulation depth ranges between:",
      "options": [
        "0\u201325%",
        "0\u201350%",
        "0\u201375%",
        "0\u2013100%"
      ],
      "answer": "0\u2013100%",
      "explanation": ""
    },
    {
      "id": "mcq_et2_ift_008",
      "question": "Spectrum is used to:",
      "options": [
        "Increase resistance",
        "Prevent accommodation",
        "Decrease circulation",
        "Reduce contact"
      ],
      "answer": "Prevent accommodation",
      "explanation": ""
    },
    {
      "id": "mcq_et2_ift_009",
      "question": "The common electrode arrangement in IFT is:",
      "options": [
        "Single electrode",
        "Two electrodes only",
        "Four electrodes in two pairs",
        "Six electrodes"
      ],
      "answer": "Four electrodes in two pairs",
      "explanation": ""
    },
    {
      "id": "mcq_et2_ift_010",
      "question": "Motor stimulation is obtained using:",
      "options": [
        "1\u2013100 Hz",
        "200\u2013500 Hz",
        "1000 Hz",
        "4000 Hz"
      ],
      "answer": "1\u2013100 Hz",
      "explanation": ""
    }
  ],
  "viva": [],
  "flashcards": [],
  "pyqs": [],
  "references": []
}