{
  "metadata": {
    "chapterId": "el2_ch7",
    "title": "",
    "subject": "Electrotherapy II",
    "subjectId": "electrotherapy_ii",
    "version": "1.0",
    "lastUpdated": "2026-06-26",
    "status": "published",
    "difficulty": "Medium",
    "estimatedStudyTime": 60,
    "keywords": [],
    "tags": []
  },
  "learningObjectives": [],
  "theory": {
    "definitions": [],
    "coreConcepts": [],
    "equipment": []
  },
  "clinicalCorrelations": {
    "pearls": [],
    "precautions": [],
    "indications": [],
    "contraindications": {
      "general": [],
      "local": []
    },
    "technique": {
      "patientPreparation": [],
      "apparatusPreparation": [],
      "skinPreparation": [],
      "electrodePlacement": [],
      "treatmentProcedure": []
    },
    "protocols": [],
    "physiologicalEffects": []
  },
  "clinicalCases": [],
  "subjectExtensions": {},
  "mcqs": [
    {
      "id": "mcq_el2_ch7_001",
      "question": "Which frequency list represents standard therapeutic ultrasound?",
      "options": [
        "1 MHz and 3 MHz",
        "10 kHz and 20 kHz",
        "27.12 MHz",
        "2450 MHz"
      ],
      "answer": "1 MHz and 3 MHz",
      "explanation": "Therapeutic ultrasound typically uses high high frequencies of 1 MHz (for deeper tissues) and 3 MHz (for superficial tissues)."
    }
  ],
  "viva": [],
  "flashcards": [],
  "pyqs": [],
  "references": []
}